{
  "id": "ec43ff73-c501-4c55-8785-9a812f009c1e",
  "schemaVersion": "1.0",
  "name": "Save a note",
  "targetPackages": [
    "com.example.notes"
  ],
  "createdAt": "2026-07-18T01:30:00Z",
  "requirements": {
    "minApiLevel": 30,
    "capabilities": [
      "accessibility.actions"
    ]
  },
  "environment": {
    "apiLevel": 36,
    "logicalWidth": 1080,
    "logicalHeight": 2400,
    "densityDpi": 420,
    "rotation": 0,
    "locale": "zh-CN"
  },
  "variables": [
    {
      "name": "noteText",
      "type": "string",
      "scope": "run",
      "sensitive": false,
      "default": "fixture note"
    }
  ],
  "steps": [
    {
      "id": "786161ea-3432-48b3-a8c2-a53d9e548aa4",
      "recordedAtMs": 320,
      "action": {
        "type": "ui.tap",
        "params": {
          "x": 540,
          "y": 1800
        }
      },
      "waitAfter": {
        "kind": "uiStable",
        "operator": "stable",
        "stableDurationMs": 300,
        "timeoutMs": 5000
      },
      "retry": {
        "maxAttempts": 2,
        "backoffMs": 200
      },
      "failurePolicy": "requestIntervention"
    }
  ]
}
